{
  "$schema": "https://json-schema.org/draft/2020-12/schema",
  "type": "object",
  "properties": {
    "generated_at": {
      "type": "string",
      "pattern": "^\\d{4}-\\d{2}-\\d{2}T\\d{2}:\\d{2}",
      "description": "When this agenda was collected, as an ISO 8601 date and time with the offset: `2026-10-20T08:15:00+01:00`."
    },
    "window": {
      "type": "object",
      "properties": {
        "start": { "type": "string", "pattern": "^\\d{4}-\\d{2}-\\d{2}$" },
        "end": { "type": "string", "pattern": "^\\d{4}-\\d{2}-\\d{2}$" }
      },
      "required": ["start", "end"],
      "additionalProperties": false,
      "description": "The first and last day the agenda covers. `end` is not before `start`."
    },
    "origin": {
      "type": "string",
      "minLength": 1,
      "description": "The town the drive times are from: `Rio Maior`."
    },
    "note": {
      "type": "string",
      "description": "Optional. One line on coverage that the page shows under its title, such as `Past mid-November this comes mostly from the municipality and the Cineteatro.` Leave it out when there is nothing to say."
    },
    "sources_checked": {
      "type": "array",
      "items": {
        "type": "object",
        "properties": {
          "name": { "type": "string", "minLength": 1 },
          "url": { "type": "string", "minLength": 1 },
          "ok": { "type": "boolean", "description": "False when the source could not be read." },
          "error": { "type": "string", "description": "Why it could not be read. Only with ok false." }
        },
        "required": ["name", "url", "ok"],
        "additionalProperties": false
      },
      "description": "Every source tried, read or not. The page lists them and marks the ones it could not read."
    },
    "events": {
      "type": "array",
      "items": {
        "type": "object",
        "properties": {
          "title_pt": { "type": "string", "minLength": 1, "description": "The title as the source gives it." },
          "title_en": { "type": "string", "minLength": 1, "description": "A short English title or gloss. The same as title_pt for a name that does not translate." },
          "category": {
            "type": "string",
            "enum": ["music", "theatre", "cinema", "festival", "market", "sport", "exhibition", "kids", "food", "nature", "workshop", "other"]
          },
          "kind": {
            "type": "string",
            "enum": ["single", "multi_day", "ongoing", "recurring"],
            "description": "single: one day. multi_day: consecutive days with an end_date after start_date. ongoing: an exhibition or run that is open throughout, with an end_date. recurring: repeats, with `dates` and/or `recurrence`."
          },
          "start_date": {
            "type": "string",
            "pattern": "^\\d{4}-\\d{2}(-\\d{2})?$",
            "description": "YYYY-MM-DD; for a recurring event, its first date in the window. YYYY-MM when date_tbc is true and only the month is known."
          },
          "end_date": {
            "type": ["string", "null"],
            "pattern": "^\\d{4}-\\d{2}-\\d{2}$",
            "description": "The last day of a multi_day or ongoing event; null for the others."
          },
          "start_time": {
            "type": ["string", "null"],
            "pattern": "^([01]\\d|2[0-3]):[0-5]\\d$",
            "description": "HH:MM, 24 hours, local time in Portugal. Null when the source gives none."
          },
          "dates": {
            "type": ["array", "null"],
            "items": { "type": "string", "pattern": "^\\d{4}-\\d{2}-\\d{2}$" },
            "description": "A recurring event's dates inside the window. Null otherwise."
          },
          "recurrence": {
            "type": ["string", "null"],
            "description": "A recurring event in words: `Every Saturday morning`. Null otherwise."
          },
          "date_tbc": {
            "type": "boolean",
            "description": "True when the event is expected but its date is not announced. Then end_date, start_time and dates are null."
          },
          "venue": { "type": ["string", "null"] },
          "town": { "type": "string", "minLength": 1, "description": "The place name alone, as in references/towns.md, with no parentheses." },
          "drive_min": {
            "type": ["integer", "null"],
            "minimum": 0,
            "description": "Minutes by car from origin, from references/towns.md; for a place not listed there, the nearest listed place's minutes. Null only when that cannot be told."
          },
          "price": {
            "type": ["object", "null"],
            "properties": {
              "free": { "type": "boolean" },
              "text": { "type": "string", "minLength": 1, "description": "`Free`, `€8`, `€5 with glass`." }
            },
            "required": ["free", "text"],
            "additionalProperties": false,
            "description": "Null when the source states no price."
          },
          "kids": { "type": "boolean", "description": "True when the source says it suits children or families." },
          "description_en": { "type": ["string", "null"], "description": "One or two plain sentences in English." },
          "sources": {
            "type": "array",
            "minItems": 1,
            "items": {
              "type": "object",
              "properties": {
                "name": { "type": "string", "minLength": 1 },
                "url": { "type": "string", "description": "Copied from the source page's own URLs. Anything that is not http or https is dropped from the page." }
              },
              "required": ["name", "url"],
              "additionalProperties": false
            }
          },
          "confidence": {
            "type": "string",
            "enum": ["high", "low"],
            "description": "Low when the date or time comes from an old poster, a social post, a guess or a source that disagrees with another."
          },
          "caveat": {
            "type": ["string", "null"],
            "description": "What to check, in a few words. Required, and not empty, when confidence is low."
          }
        },
        "required": [
          "title_pt", "title_en", "category", "kind", "start_date", "end_date", "start_time", "dates",
          "recurrence", "date_tbc", "venue", "town", "drive_min", "price", "kids", "description_en",
          "sources", "confidence", "caveat"
        ],
        "additionalProperties": false,
        "if": { "properties": { "confidence": { "const": "low" } } },
        "then": { "properties": { "caveat": { "type": "string", "minLength": 1 } } }
      }
    }
  },
  "required": ["generated_at", "window", "origin", "sources_checked", "events"],
  "additionalProperties": false
}
